633,HOMBA:AA30237,InAs,small intercalated nuclei of amygdala,1041,,,,255,215,180,,,,,,,,,,small intercalated nuclei of amygdala,,,,,,HOMBA:10378,631.0
634,HOMBA:10379,ATA,amygdaloid transition areas,110,amygdaloid transition areas,ATA,10379.0,205,203,198,,,,,,,,,amygdaloid transition areas,,,,,,,HOMBA:AA30222,568.0
635,HOMBA:10380,AHTA,amygdalohippocampal transition area,111,amygdalohippocampal transition area,AHTA,10380.0,89,52,183,,,,,,,,,,amygdalohippocampal transition area,,,,,,HOMBA:10379,634.0
636,HOMBA:AA30238,AHTAmc,magnocellular division of AHTA,1042,,,,128,128,128,,,,,,,,,,,magnocellular division of AHTA,,,,,HOMBA:10380,635.0
637,HOMBA:AA30239,AHTApc,parvicellular division of AHTA,1043,,,,210,245,60,,,,,,,,,,,parvicellular division of AHTA,,,,,HOMBA:10380,635.0
638,HOMBA:10382,ACTA,amygdalocortical transition area (amygdalopiriform transition area),113,amygdalocortical (corticoamygdaloid) transition area,ACTA,10382.0,199,105,19,,,,,,,,,,amygdalocortical transition area (amygdalopiriform transition area),,,,,,HOMBA:10379,634.0
639,HOMBA:AA30240,AMYx,uncharted (diffuse) part of amygdaloid complex,1044,,,,70,240,240,,,,,,,,,uncharted (diffuse) part of amygdaloid complex,,,,,,,HOMBA:AA30222,568.0
640,HOMBA:AA30241,AMYDe, developing transient structures of amygdalar region,1045,,,,70,240,240,,,,,,,, developing transient structures of amygdalar region,,,,,,,,HOMBA:10361,567.0
641,HOMBA:10553,paVZ,ventricular-subventricular zone of postamygdaloid region,1046,VZ in postamygdaloid region,paVZ,10553.0,250,190,212,,,,,,,,,ventricular-subventricular zone of postamygdaloid region,,,,,,,HOMBA:AA30241,640.0
642,HOMBA:AA30242,CAS,caudal amygdaloid migratory stream,1047,,,,230,25,75,,,,,,,,,caudal amygdaloid migratory stream,,,,,,,HOMBA:AA30241,640.0
643,HOMBA:10383,EXA,extended amygdala,114,extended amygdala,EXA,10383.0,73,66,52,,,,,,,extended amygdala,,,,,,,,,HOMBA:10331,450.0
644,HOMBA:AA30243,EXAR,regions of extended amygdala,1048,,,,0,0,128,,,,,,,,regions of extended amygdala,,,,,,,,HOMBA:10383,643.0
645,HOMBA:10384,BST,bed nucleus of stria terminalis,115,bed nucleus of stria terminalis,BNST,10384.0,240,50,230,,,,,,,,,bed nucleus of stria terminalis,,,,,,,HOMBA:AA30243,644.0
646,HOMBA:AA30244,BSTr,rostral nuclear complex of BST,1049,,,,0,128,128,,,,,,,,,,rostral nuclear complex of BST,,,,,,HOMBA:10384,645.0
647,HOMBA:AA30245,BSTrm,medial division of BSTr,1050,,,,210,245,60,,,,,,,,,,,medial division of BSTr,,,,,HOMBA:AA30244,646.0
648,HOMBA:AA30246,BSTrl,lateral division of BNSr,1051,,,,74,125,153,,,,,,,,,,,lateral division of BNSr,,,,,HOMBA:AA30244,646.0
649,HOMBA:AA30247,BSTrlj,juxtacapsular subdivision of BSTrl,1052,,,,255,250,200,,,,,,,,,,,,juxtacapsular subdivision of BSTrl,,,,HOMBA:AA30246,648.0
650,HOMBA:AA30248,BSTrlv,ventral  subdivision of BSTrl,1053,,,,21,64,86,,,,,,,,,,,,ventral  subdivision of BSTrl,,,,HOMBA:AA30246,648.0
651,HOMBA:AA30249,BSTfu,fusiform nucleus of BSTrl,1054,,,,0,130,200,,,,,,,,,,,,fusiform nucleus of BSTrl,,,,HOMBA:AA30246,648.0
652,HOMBA:AA30250,BSTov,oval division of BSTr,1055,,,,128,0,0,,,,,,,,,,,oval division of BSTr,,,,,HOMBA:AA30244,646.0
653,HOMBA:AA30251,BSTc,caudal nuclear complex of BST,1056,,,,245,130,48,,,,,,,,,,caudal nuclear complex of BST,,,,,,HOMBA:10384,645.0
654,HOMBA:AA30252,BSTcm,medial division of BSTc,1057,,,,70,240,240,,,,,,,,,,,medial division of BSTc,,,,,HOMBA:AA30251,653.0
655,HOMBA:AA30253,BSTpr,principal  subdivision of BSTcm,1058,,,,0,130,200,,,,,,,,,,,,principal  subdivision of BSTcm,,,,HOMBA:AA30252,654.0
656,HOMBA:AA30254,BSTprd,dorsal part of BSTpr,1059,,,,128,128,0,,,,,,,,,,,,,dorsal part of BSTpr,,,HOMBA:AA30253,655.0
657,HOMBA:AA30255,BSTprv,ventral part of BSTpr,1060,,,,245,130,48,,,,,,,,,,,,,ventral part of BSTpr,,,HOMBA:AA30253,655.0
658,HOMBA:AA30256,BSTif,interfascicular subdivision of BSTcm,1061,,,,255,250,200,,,,,,,,,,,,interfascicular subdivision of BSTcm,,,,HOMBA:AA30252,654.0
659,HOMBA:AA30257,BSTcl,lateral division of BSTc,1062,,,,60,180,75,,,,,,,,,,,lateral division of BSTc,,,,,HOMBA:AA30251,653.0
660,HOMBA:AA30258,BSTsc,spindle-shaped small cell division of BST,1063,,,,128,128,128,,,,,,,,,,spindle-shaped small cell division of BST,,,,,,HOMBA:10384,645.0
661,HOMBA:AA30259,BSTst,remaining caudal extension of BST (along stria terminaris),1064,,,,0,200,150,,,,,,,,,,remaining caudal extension of BST (along stria terminaris),,,,,,HOMBA:10384,645.0
662,HOMBA:10387,SLEA,sublenticular extended amygdala,116,sublenticular extended amygdala,SLEA,10387.0,207,116,12,,,,,,,,,sublenticular extended amygdala,,,,,,,HOMBA:AA30243,644.0
663,HOMBA:11569,SLEAm,medial division of SLEA,1065,medial division of sublenticular extended amygdala,SLEAm,11569.0,170,110,40,,,,,,,,,,medial division of SLEA,,,,,,HOMBA:10387,662.0
664,HOMBA:11570,SLEAl,lateral division of SLEA,1066,central division of sublenticular extended amygdala,SLEAc,11570.0,255,215,180,,,,,,,,,,lateral division of SLEA,,,,,,HOMBA:10387,662.0
665,HOMBA:AA30260,EXADe,developing transient structures of extended amygdala,1067,,,,170,110,40,,,,,,,,developing transient structures of extended amygdala,,,,,,,,HOMBA:10383,643.0
666,HOMBA:AA30261,EXAvz,ventricular-subventricular zone of extended amygdala,1068,,,,220,190,255,,,,,,,,,ventricular-subventricular zone of extended amygdala,,,,,,,HOMBA:AA30260,665.0
667,HOMBA:AA30262,CLEn,claustrum-endopiriform nuclear complex,1069,,,,170,255,195,,,,,,,claustrum-endopiriform nuclear complex,,,,,,,,,HOMBA:10331,450.0
668,HOMBA:AA30263,CLEnR,regions of claustrum-endopiriform nuclear complex,1070,,,,245,130,48,,,,,,,,regions of claustrum-endopiriform nuclear complex,,,,,,,,HOMBA:AA30262,667.0
669,HOMBA:10346,Cla,claustrum,135,claustrum,Cla,10346.0,44,101,185,,,,,,,,,claustrum,,,,,,,HOMBA:AA30263,668.0
670,HOMBA:10347,CLd,dorsal claustrum,136,Dorsal claustrum,CLd,10347.0,228,2,208,,,,,,,,,,dorsal claustrum,,,,,,HOMBA:10346,669.0
671,HOMBA:10348,CLv,ventral claustrum,137,ventral claustrum,CLv,10348.0,137,216,173,,,,,,,,,,ventral claustrum,,,,,,HOMBA:10346,669.0
672,HOMBA:146034762,CLt,temporal claustrum,138,temporal claustrum,CLt,146034762.0,207,216,155,,,,,,,,,,temporal claustrum,,,,,,HOMBA:10346,669.0
673,HOMBA:AA30780,CLmc,magnocellular division of claustrum,2329,,,,128,128,0,,,,,,,,,,magnocellular division of claustrum,,,,,,HOMBA:10346,669.0
674,HOMBA:10371,En,endopiriform nucleus,1071,endopiriform nucleus,En,10371.0,240,50,230,,,,,,,,,endopiriform nucleus,,,,,,,HOMBA:AA30263,668.0
675,HOMBA:AA30264,EnD,dorsal endopiriform nucleus,1072,,,,70,240,240,,,,,,,,,,dorsal endopiriform nucleus,,,,,,HOMBA:10371,674.0
676,HOMBA:AA30854,EnV,ventral endopiriform nucleus,1073,,,,220,190,255,,,,,,,,,,ventral endopiriform nucleus,,,,,,HOMBA:10371,674.0
677,HOMBA:10389,DiE,diencephalon,148,diencephalon,Die,10389.0,255,250,200,,,,,diencephalon,,,,,,,,,,,HOMBA:10156,3.0
678,HOMBA:10390,THM,thalamus,149,thalamus,THM,10390.0,159,19,8,,,,,,thalamus,,,,,,,,,,HOMBA:10389,677.0
679,HOMBA:AA30265,THMR,regions of thalamus,1074,,,,0,0,128,,,,,,,regions of thalamus,,,,,,,,,HOMBA:10390,678.0
680,HOMBA:10391,DTH,dorsal thalamus,150,dorsal thalamus,DTH,10391.0,75,188,207,,,,,,,,dorsal thalamus,,,,,,,,HOMBA:AA30265,679.0
681,HOMBA:10392,ANC,anterior nuclear complex of thalamus,151,anterior nuclear complex of thalamus,ANC,10392.0,25,46,148,,,,,,,,,anterior nuclear complex of thalamus,,,,,,,HOMBA:10391,680.0
682,HOMBA:10393,AD,anterodorsal nucleus of thalamus,152,anterodorsal nucleus of thalamus,AD,10393.0,164,159,18,,,,,,,,,,anterodorsal nucleus of thalamus,,,,,,HOMBA:10392,681.0
683,HOMBA:AA30266,ADm,medial (parvicellular) division of AD,1075,,,,170,110,40,,,,,,,,,,,medial (parvicellular) division of AD,,,,,HOMBA:10393,682.0
684,HOMBA:AA30267,ADl,lateral (magocellular) division of AD,1076,,,,0,128,128,,,,,,,,,,,lateral (magocellular) division of AD,,,,,HOMBA:10393,682.0
685,HOMBA:AA30268,IAD,interanterodorsal nucleus of thalamus,1077,,,,210,245,60,,,,,,,,,,interanterodorsal nucleus of thalamus,,,,,,HOMBA:10392,681.0
686,HOMBA:10395,AV,anteroventral nucleus of thalamus,154,anteroventral nucleus of thalamus,AV,10395.0,213,92,32,,,,,,,,,,anteroventral nucleus of thalamus,,,,,,HOMBA:10392,681.0
687,HOMBA:AA30269,AVdm,dorsomedial division of AV,1078,,,,70,240,240,,,,,,,,,,,dorsomedial division of AV,,,,,HOMBA:10395,686.0
688,HOMBA:AA30270,AVvl,ventrolateral division of AV,1079,,,,170,255,195,,,,,,,,,,,ventrolateral division of AV,,,,,HOMBA:10395,686.0
689,HOMBA:10394,AM,anteromedial nucleus of thalamus,153,anteromedial nucleus of thalamus,AM,10394.0,231,127,150,,,,,,,,,,anteromedial nucleus of thalamus,,,,,,HOMBA:10392,681.0
690,HOMBA:AA30271,AMd,dorsal division of AM,1080,,,,0,128,128,,,,,,,,,,,dorsal division of AM,,,,,HOMBA:10394,689.0
691,HOMBA:AA30272,AMv,ventral division of AM,1081,,,,70,240,240,,,,,,,,,,,ventral division of AM,,,,,HOMBA:10394,689.0
692,HOMBA:10397,MNC,medial nuclear complex of thalamus,156,medial nuclear complex of thalamus,MNC,10397.0,189,74,138,,,,,,,,,medial nuclear complex of thalamus,,,,,,,HOMBA:10391,680.0
693,HOMBA:10398,MD,mediodorsal nucleus of thalamus,157,mediodorsal nucleus of thalamus,MD,10398.0,213,138,107,,,,,,,,,,mediodorsal nucleus of thalamus,,,,,,HOMBA:10397,692.0
694,HOMBA:10399,MDdc,densocelllular (paralamellar) division of MD,1082,densocelllular (paralamellar) division of MD,MDd,10399.0,128,0,0,,,,,,,,,,,densocelllular (paralamellar) division of MD,,,,,HOMBA:10398,693.0
695,HOMBA:10400,MDm,medial (magnocellular) division of MD,1083,magnocellular (medial) division of MD,MDm,10400.0,170,255,195,,,,,,,,,,,medial (magnocellular) division of MD,,,,,HOMBA:10398,693.0
696,HOMBA:266441507,MDam,anteromedial large-celled island of MD ,1084,anteromedial large-celled island of MD ,MDam,266441507.0,255,225,25,,,,,,,,,,,anteromedial large-celled island of MD ,,,,,HOMBA:10398,693.0
697,HOMBA:10401,MDl,lateral (multiform) division of MD,1085,multiform (lateral) division of MD,MDl,10401.0,255,215,180,,,,,,,,,,,lateral (multiform) division of MD,,,,,HOMBA:10398,693.0
698,HOMBA:10402,MDc,central (parvicellular) division of MD,1086,parvocellular (central) division of MD,MDc,10402.0,60,180,75,,,,,,,,,,,central (parvicellular) division of MD,,,,,HOMBA:10398,693.0
699,HOMBA:AA30273,MDv,ventral division of MD,1087,,,,0,130,200,,,,,,,,,,,ventral division of MD,,,,,HOMBA:10398,693.0
700,HOMBA:13045,MiN,midline nuclear complex of thalamus,186,midline nuclear complex,MiN,13045.0,254,246,169,,,,,,,,,midline nuclear complex of thalamus,,,,,,,HOMBA:10391,680.0
701,HOMBA:AA30274,MiD,dorsal midline nuclei of thalamus,1088,,,,220,190,255,,,,,,,,,,dorsal midline nuclei of thalamus,,,,,,HOMBA:13045,700.0
702,HOMBA:10457,PVT,paraventricular nucleus of thalamus,191,paraventricular nucleus,PaV,10457.0,250,190,212,,,,,,,,,,,paraventricular nucleus of thalamus,,,,,HOMBA:AA30274,701.0
703,HOMBA:10458,PVTr,rostral paraventricular nucleus of thalamus,1089,rostral subdivision of paraventricular nucleus,PaVr,10458.0,70,240,240,,,,,,,,,,,,rostral paraventricular nucleus of thalamus,,,,HOMBA:10457,702.0
704,HOMBA:AA30275,PVTi,intermediate paraventricular nucleus of thalamus,1090,,,,0,0,128,,,,,,,,,,,,intermediate paraventricular nucleus of thalamus,,,,HOMBA:10457,702.0
705,HOMBA:10459,PVTc,caudal paraventricular nucleus of thalamus,1091,caudal subdivision of paraventricular nucleus,PaVc,10459.0,255,225,25,,,,,,,,,,,,caudal paraventricular nucleus of thalamus,,,,HOMBA:10457,702.0
706,HOMBA:10404,PT,parataenial nucleus of thalamus,159,parataenial nucleus of thalamus,Pt,10404.0,128,128,128,,,,,,,,,,,parataenial nucleus of thalamus,,,,,HOMBA:AA30274,701.0
707,HOMBA:13049,IMD,intermediodorsal  nucleus of thalamus,1092,intermediodorsal  nucleus of thalamus,IMD,13049.0,128,25,255,,,,,,,,,,,intermediodorsal  nucleus of thalamus,,,,,HOMBA:AA30274,701.0
708,HOMBA:AA30276,MiV,ventral midline nuclei of thalamus,1093,,,,230,25,75,,,,,,,,,,ventral midline nuclei of thalamus,,,,,,HOMBA:13045,700.0
709,HOMBA:10403,Re,reuniens (medioventral) nucleus of thalamus,158,reuniens nucleus (medioventral nucleus) of thalamus,Re,10403.0,60,24,145,,,,,,,,,,,reuniens (medioventral) nucleus of thalamus,,,,,HOMBA:AA30276,708.0
710,HOMBA:AA30277,Xi,xiphoid thalamic nucleus,1094,,,,128,0,0,,,,,,,,,,,xiphoid thalamic nucleus,,,,,HOMBA:AA30276,708.0
711,HOMBA:AA30278,SmT,submedius thalamic nucleus,1095,,,,255,215,180,,,,,,,,,,,submedius thalamic nucleus,,,,,HOMBA:AA30276,708.0
712,HOMBA:13047,Fa,fasciculosus nucleus of thalamus,1096,fasciculosus nucleus of thalamus,Fa,13047.0,210,245,60,,,,,,,,,,,fasciculosus nucleus of thalamus,,,,,HOMBA:AA30276,708.0
713,HOMBA:13048,IAM,interanteromedial nucleus of thalamus,1097,interanteromedial nucleus of thalamus,IAM,13048.0,128,0,0,,,,,,,,,,,interanteromedial nucleus of thalamus,,,,,HOMBA:AA30276,708.0
714,HOMBA:10447,Rh,rhomboid (central) nucleus of thalamus,1098,rhomboid (central) nucleus of thalamus,Rh,10447.0,128,128,0,,,,,,,,,,,rhomboid (central) nucleus of thalamus,,,,,HOMBA:AA30276,708.0
715,HOMBA:13046,PeVA,periventricular area of posterior thalamus,1099,periventricular area of thalamus,PeVA,13046.0,207,161,54,,,,,,,,,,,periventricular area of posterior thalamus,,,,,HOMBA:AA30276,708.0
716,HOMBA:13054,SPf,subparafascicular nucleus of thalamus,185,subparafascicular nucleus of thalamus,SPf,13054.0,32,229,168,,,,,,,,,,,subparafascicular nucleus of thalamus,,,,,HOMBA:AA30276,708.0
717,HOMBA:15534,RPf,retroparafascicular area of thalamus,1100,retroparafascicular area of thalamus,RPf,15534.0,0,128,128,,,,,,,,,,,retroparafascicular area of thalamus,,,,,HOMBA:AA30276,708.0
718,HOMBA:AA30279,RRe,retrouniens area,1101,,,,250,190,212,,,,,,,,,,,retrouniens area,,,,,HOMBA:AA30276,708.0
719,HOMBA:10406,LNC,lateral nuclear complex of thalamus,160,lateral nuclear complex of thalamus,LNC,10406.0,80,189,122,,,,,,,,,lateral nuclear complex of thalamus,,,,,,,HOMBA:10391,680.0
720,HOMBA:10407,DLN,dorsal group of LNC,161,dorsal group of lateral nucleus,DLN,10407.0,177,189,142,,,,,,,,,,dorsal group of LNC,,,,,,HOMBA:10406,719.0
721,HOMBA:10396,LD,lateral dorsal nucleus of thalamus,155,lateral dorsal nucleus of thalamus,LD,10396.0,13,108,46,,,,,,,,,,,lateral dorsal nucleus of thalamus,,,,,HOMBA:10407,720.0
722,HOMBA:AA30280,LDd,dorsal division of LD,1102,,,,240,50,230,,,,,,,,,,,,dorsal division of LD,,,,HOMBA:10396,721.0
723,HOMBA:AA30281,LDv,ventral division of LD,1103,,,,255,215,180,,,,,,,,,,,,ventral division of LD,,,,HOMBA:10396,721.0
724,HOMBA:AA30282,LPul,lateroposterior-pulvinar complex,1104,,,,250,190,212,,,,,,,,,,,lateroposterior-pulvinar complex,,,,,HOMBA:10407,720.0
725,HOMBA:10408,LP,lateral posterior nucleus of thalamus,162,lateral posterior nucleus of thalamus,LP,10408.0,139,8,203,,,,,,,,,,,,lateral posterior nucleus of thalamus,,,,HOMBA:AA30282,724.0
726,HOMBA:AA30283,LPd,dorsal division of LP,1105,,,,145,30,180,,,,,,,,,,,,,dorsal division of LP,,,HOMBA:10408,725.0
727,HOMBA:AA30284,LPv,ventral division of LP,1106,,,,240,50,230,,,,,,,,,,,,,ventral division of LP,,,HOMBA:10408,725.0
728,HOMBA:10409,Pul,pulvinar of thalamus,163,pulvinar of thalamus,Pul,10409.0,8,115,179,,,,,,,,,,,,pulvinar of thalamus,,,,HOMBA:AA30282,724.0
729,HOMBA:10410,Pulr,rostral division of pulvinar,1107,anterior nucleus of pulvinar,Pulr,10410.0,128,128,0,,,,,,,,,,,,,rostral division of pulvinar,,,HOMBA:10409,728.0
730,HOMBA:10411,Pulm,medial division of pulvinar,1108,medial nucleus of pulvinar,Pulm,10411.0,128,0,0,,,,,,,,,,,,,medial division of pulvinar,,,HOMBA:10409,728.0
731,HOMBA:10412,Pull,lateral division of pulvinar,1109,lateral nucleus of pulvinar,Pull,10412.0,245,130,48,,,,,,,,,,,,,lateral division of pulvinar,,,HOMBA:10409,728.0
732,HOMBA:AA30285,Pulldm,dorsomedial subdivision of Pull,1110,,,,170,110,40,,,,,,,,,,,,,,dorsomedial subdivision of Pull,,HOMBA:10412,731.0
733,HOMBA:AA30286,Pullvl,ventrolateral subdivision of Pull,1111,,,,145,30,180,,,,,,,,,,,,,,ventrolateral subdivision of Pull,,HOMBA:10412,731.0
734,HOMBA:10413,Puli,inferior division of pulvinar,1112,inferior nucleus of pulvinar,Puli,10413.0,255,250,200,,,,,,,,,,,,,inferior division of pulvinar,,,HOMBA:10409,728.0
735,HOMBA:10414,Pulil,lateral subdivision of Puli,1113,lateral subdivision of Puli,Pulil,10414.0,255,215,180,,,,,,,,,,,,,,lateral subdivision of Puli,,HOMBA:10413,734.0
736,HOMBA:AA30287,Pulic,central subdivision of Puli,1114,,,,255,215,180,,,,,,,,,,,,,,central subdivision of Puli,,HOMBA:10413,734.0
737,HOMBA:10415,Pulim,medial subdivision of Puli,1115,medial subdivision of Puli,Pulim,10415.0,126,118,42,,,,,,,,,,,,,,medial subdivision of Puli,,HOMBA:10413,734.0
738,HOMBA:AA30288,Pulip,posterior subdivision of Puli,1116,,,,170,110,40,,,,,,,,,,,,,,posterior subdivision of Puli,,HOMBA:10413,734.0
739,HOMBA:10416,VLN,ventral group of LNC,164,ventral group of lateral nucleus,VLN,10416.0,100,90,79,,,,,,,,,,ventral group of LNC,,,,,,HOMBA:10406,719.0
740,HOMBA:AA30289,VAL,ventroanterior-ventrolateral nuclear complex of thalamus,1117,,,,255,215,180,,,,,,,,,,,ventroanterior-ventrolateral nuclear complex of thalamus,,,,,HOMBA:10416,739.0
741,HOMBA:10417,VA,ventral anterior nucleus of thalamus,165,ventral anterior nucleus of thalamus,VA,10417.0,218,147,208,,,,,,,,,,,,ventral anterior nucleus of thalamus,,,,HOMBA:AA30289,740.0
742,HOMBA:10418,VApr,principal division of VA,1118,parvocellular division of VA,VApr,10418.0,220,190,255,,,,,,,,,,,,,principal division of VA,,,HOMBA:10417,741.0
743,HOMBA:AA30290,VAm,medial subdivision of VApr,1119,,,,230,25,75,,,,,,,,,,,,,,medial subdivision of VApr,,HOMBA:10418,742.0
744,HOMBA:AA30291,VAl,lateral subdivision of VApr,1120,,,,210,245,60,,,,,,,,,,,,,,lateral subdivision of VApr,,HOMBA:10418,742.0
745,HOMBA:AA30292,VAcd,caudodorsal extension of VA,1121,,,,250,190,212,,,,,,,,,,,,,,caudodorsal extension of VA,,HOMBA:10418,742.0
746,HOMBA:10419,VAmc,magocellular division of VA,1122,magnocellular division of VA,VAmc,10419.0,109,216,212,,,,,,,,,,,,,magocellular division of VA,,,HOMBA:10417,741.0
747,HOMBA:10420,VL,ventral lateral nucleus of thalamus,166,ventral lateral nucleus of thalamus,VL,10420.0,4,188,151,,,,,,,,,,,,ventral lateral nucleus of thalamus,,,,HOMBA:AA30289,740.0
748,HOMBA:10421,VLr,rostral division of VL,1123,rostral division of VL,VLR,10421.0,145,30,180,,,,,,,,,,,,,rostral division of VL,,,HOMBA:10420,747.0
749,HOMBA:13039,VLx,medial division of VL (nucleus x of thalamus),1124,medial subdivision of VLC (area x),VLCx,13039.0,162,52,27,,,,,,,,,,,,,medial division of VL (nucleus x of thalamus),,,HOMBA:10420,747.0
750,HOMBA:10422,VLc,caudal division of VL,1125,caudal division of VL,VLC,10422.0,128,128,128,,,,,,,,,,,,,caudal division of VL,,,HOMBA:10420,747.0
751,HOMBA:13037,VLcd,dorsal subdivision of caudal subdivision of VL,1126,dorsal subdivision of VLC,VLCd,13037.0,220,190,255,,,,,,,,,,,,,,dorsal subdivision of caudal subdivision of VL,,HOMBA:10422,750.0
752,HOMBA:13038,VLcv,ventral subdivision of caudal subdivision of VL,1127,ventral subdivision of VLC,VLCv,13038.0,255,215,180,,,,,,,,,,,,,,ventral subdivision of caudal subdivision of VL,,HOMBA:10422,750.0
753,HOMBA:AA30293,VLvm,ventromedial division of VL,1128,,,,220,190,255,,,,,,,,,,,,,ventromedial division of VL,,,HOMBA:10420,747.0
754,HOMBA:10427,VM,ventral medial nucleus of thalamus,172,ventral medial nucleus of thalamus,VM,10427.0,53,152,218,,,,,,,,,,,,ventral medial nucleus of thalamus,,,,HOMBA:AA30289,740.0
755,HOMBA:10423,VPT,ventral posterior nuclear complex of thalamus,167,ventral posterior nucleus of thalamus,VPT,10423.0,42,48,101,,,,,,,,,,,ventral posterior nuclear complex of thalamus,,,,,HOMBA:10416,739.0
756,HOMBA:10424,VPL,ventral posterior lateral nucleus,168,ventral posterior lateral nucleus,VPL,10424.0,32,35,172,,,,,,,,,,,,ventral posterior lateral nucleus,,,,HOMBA:10423,755.0
757,HOMBA:266441511,VPLr,rostral division of ventral posterior lateral nucleus,1129,rostral division of ventral posterior lateral nucleus,VPLr,266441511.0,170,255,195,,,,,,,,,,,,,rostral division of ventral posterior lateral nucleus,,,HOMBA:10424,756.0
758,HOMBA:266441515,VPLc,caudal division of ventral posterior lateral nucleus,1130,caudal division of ventral posterior lateral nucleus,VPLc,266441515.0,142,188,198,,,,,,,,,,,,,caudal division of ventral posterior lateral nucleus,,,HOMBA:10424,756.0
759,HOMBA:10425,VPM,ventral posterior medial nucleus,169,ventral posterior medial nucleus,VPM,10425.0,136,49,69,,,,,,,,,,,,ventral posterior medial nucleus,,,,HOMBA:10423,755.0
760,HOMBA:AA30294,VPS,ventral posterior superior nucleus,1131,,,,70,240,240,,,,,,,,,,,,ventral posterior superior nucleus,,,,HOMBA:10423,755.0
761,HOMBA:146034766,VPpc,parvicellular ventral posterior (medial) nucleus (VPMpc),1132,parvocellular division of VPM,VPMpc,146034766.0,255,250,200,,,,,,,,,,,,parvicellular ventral posterior (medial) nucleus (VPMpc),,,,HOMBA:10423,755.0
762,HOMBA:10426,VPI,ventral posterior inferior nucleus,170,ventral posterior inferior nucleus,VPI,10426.0,144,26,188,,,,,,,,,,,,ventral posterior inferior nucleus,,,,HOMBA:10423,755.0
763,HOMBA:13040,VMb,basal ventral medial nucleus,171,basal ventral medial nucleus,VMb,13040.0,143,106,163,,,,,,,,,,,,basal ventral medial nucleus,,,,HOMBA:10423,755.0
764,HOMBA:10428,PoN,posterior nuclear complex of thalamus,173,posterior nuclear complex of thalamus,PoN,10428.0,147,21,65,,,,,,,,,posterior nuclear complex of thalamus,,,,,,,HOMBA:10391,680.0
765,HOMBA:AA30295,LGC,lateral geniculate nuclear complex,1133,,,,170,110,40,,,,,,,,,,lateral geniculate nuclear complex,,,,,,HOMBA:10428,764.0
766,HOMBA:10429,LG,lateral geniculate nucleus (dorsal lateral geniculate nucleus),174,lateral geniculate nucleus,LG,10429.0,98,249,223,,,,,,,,,,,lateral geniculate nucleus (dorsal lateral geniculate nucleus),,,,,HOMBA:AA30295,765.0
767,HOMBA:10431,LGmc,magnocellular layers of LG,1134,magnocellular layer of DLG,DLGmc,10431.0,0,128,128,,,,,,,,,,,,magnocellular layers of LG,,,,HOMBA:10429,766.0
768,HOMBA:11571,LG1,layer 1 of LG,1135,layer 1 of DLG,DLG1,11571.0,255,250,200,,,,,,,,,,,,,layer 1 of LG,,,HOMBA:10431,767.0
769,HOMBA:11572,LG2,layer 2 of LG,1136,layer 2 of DLG,DLG2,11572.0,210,245,60,,,,,,,,,,,,,layer 2 of LG,,,HOMBA:10431,767.0
770,HOMBA:10432,LGpc,parvicellular layers of LG,1137,parvicellular layer of DLG,DLGpc,10432.0,0,128,128,,,,,,,,,,,,parvicellular layers of LG,,,,HOMBA:10429,766.0
771,HOMBA:11573,LG3,layer 3 of LG,1138,layer 3 of DLG,DLG3,11573.0,240,50,230,,,,,,,,,,,,,layer 3 of LG,,,HOMBA:10432,770.0
772,HOMBA:11574,LG4,layer 4 of LG,1139,layer 4 of DLG,DLG4,11574.0,220,190,255,,,,,,,,,,,,,layer 4 of LG,,,HOMBA:10432,770.0
773,HOMBA:11575,LG5,layer 5 of LG,1140,layer 5 of DLG,DLG5,11575.0,230,25,75,,,,,,,,,,,,,layer 5 of LG,,,HOMBA:10432,770.0
774,HOMBA:11576,LG6,layer 6 of LG,1141,layer 6 of DLG,DLG6,11576.0,250,190,212,,,,,,,,,,,,,layer 6 of LG,,,HOMBA:10432,770.0
775,HOMBA:266441519,LGko,koniocellular layers of LG,1142,koniocellular layer of DLG,DLGk,266441519.0,240,50,230,,,,,,,,,,,,koniocellular layers of LG,,,,HOMBA:10429,766.0
776,HOMBA:AA30296,LGko1,layer 1 (S layer) of LGko,1143,,,,220,190,255,,,,,,,,,,,,,layer 1 (S layer) of LGko,,,HOMBA:266441519,775.0
777,HOMBA:AA30297,LGko2,layer 2 of LGko,1144,,,,70,240,240,,,,,,,,,,,,,layer 2 of LGko,,,HOMBA:266441519,775.0
778,HOMBA:AA30298,LGko3,layer 3 of LGko,1145,,,,0,0,128,,,,,,,,,,,,,layer 3 of LGko,,,HOMBA:266441519,775.0
779,HOMBA:AA30299,LGko4,layer 4 of LGko,1146,,,,240,50,230,,,,,,,,,,,,,layer 4 of LGko,,,HOMBA:266441519,775.0
780,HOMBA:AA30300,LGko5,layer 5 of LGko,1147,,,,128,128,128,,,,,,,,,,,,,layer 5 of LGko,,,HOMBA:266441519,775.0
781,HOMBA:AA30301,LGko6,layer 6 of LGko,1148,,,,250,190,212,,,,,,,,,,,,,layer 6 of LGko,,,HOMBA:266441519,775.0
782,HOMBA:13042,PG,pregeniculate nucleus (ventral lateral geniculate nucleus),176,pregeniculate nucleus,PG,13042.0,150,77,31,,,,,,,,,,,pregeniculate nucleus (ventral lateral geniculate nucleus),,,,,HOMBA:AA30295,765.0
783,HOMBA:AA30302,PGpr,principal pregeniculate nucleus,1149,,,,128,0,0,,,,,,,,,,,,principal pregeniculate nucleus,,,,HOMBA:13042,782.0
784,HOMBA:AA30303,PGpc,parvicellular division of PGpr,1150,,,,60,180,75,,,,,,,,,,,,,parvicellular division of PGpr,,,HOMBA:AA30302,783.0
785,HOMBA:AA30304,PGmc,magocellular division of PGpr,1151,,,,145,30,180,,,,,,,,,,,,,magocellular division of PGpr,,,HOMBA:AA30302,783.0
786,HOMBA:AA30305,IGL,intergeniculate leaf,1152,,,,145,30,180,,,,,,,,,,,,,intergeniculate leaf,,,HOMBA:AA30302,783.0
787,HOMBA:AA30306,PGov,oval body of pregeniculate nucleus,1153,,,,0,128,128,,,,,,,,,,,,oval body of pregeniculate nucleus,,,,HOMBA:13042,782.0
788,HOMBA:AA30307,MGC,medial geniculate nuclear complex,1154,,,,145,30,180,,,,,,,,,,medial geniculate nuclear complex,,,,,,HOMBA:10428,764.0
789,HOMBA:10434,MG,medial geniculate nucleus,177,medial geniculate nuclei,MG,10434.0,17,142,10,,,,,,,,,,,medial geniculate nucleus,,,,,HOMBA:AA30307,788.0
790,HOMBA:10435,DMG,dorsal (rostral) division of medial geniculate nucleus,1155,dorsal medial geniculate nucleus,DMG,10435.0,60,180,75,,,,,,,,,,,,dorsal (rostral) division of medial geniculate nucleus,,,,HOMBA:10434,789.0
791,HOMBA:10436,DMGrd,rostrodorsal subdivision of DMG,1156,anterodorsal subdivision of DMG,DMGad,10436.0,145,30,180,,,,,,,,,,,,,rostrodorsal subdivision of DMG,,,HOMBA:10435,790.0
792,HOMBA:10437,DMGcd,caudodorsal subdivision of DMG,1157,posterodorsal subdivision of DMG,DMGpd,10437.0,250,190,212,,,,,,,,,,,,,caudodorsal subdivision of DMG,,,HOMBA:10435,790.0
793,HOMBA:10438,VMG,ventral (caudal) division of medial geniculate nucleus,1158,ventral medial geniculate nucleus,VMG,10438.0,128,0,0,,,,,,,,,,,,ventral (caudal) division of medial geniculate nucleus,,,,HOMBA:10434,789.0
794,HOMBA:AA30308,VMGr,rostral subdivision of the VMG,1159,,,,60,180,75,,,,,,,,,,,,,rostral subdivision of the VMG,,,HOMBA:10438,793.0
795,HOMBA:AA30309,VMGc,caudal subdivision of the VMG,1160,,,,170,255,195,,,,,,,,,,,,,caudal subdivision of the VMG,,,HOMBA:10438,793.0
